{
  "$schema": "../../schemas/library-index.schema.json",
  "version": "1.0.0",
  "generatedAt": "2026-09-02",
  "disclaimer": {
    "en": "Reference only; verify with the official gazette/order or your DDO.",
    "hi": "केवल संदर्भ के लिए; आधिकारिक राजपत्र/आदेश अथवा अपने डीडीओ से सत्यापित करें।"
  },
  "totals": {
    "works": 15,
    "units": 1877,
    "minutes": 3441
  },
  "works": [
    {
      "id": "bns",
      "title": {
        "en": "Bharatiya Nyaya Sanhita, 2023",
        "hi": "भारतीय न्याय संहिता, 2023"
      },
      "shortTitle": {
        "en": "BNS",
        "hi": "BNS"
      },
      "year": 2023,
      "category": "criminal-law",
      "description": {
        "en": "The Bharatiya Nyaya Sanhita — the substantive criminal law that replaced the Indian Penal Code on 1 July 2024. Offences, general exceptions and punishments, chapter by chapter.",
        "hi": "भारतीय न्याय संहिता — वह मूल दंड विधि जिसने 1 जुलाई 2024 को भारतीय दण्ड संहिता का स्थान लिया। अपराध, साधारण अपवाद तथा दंड, अध्यायवार।"
      },
      "unitLabel": {
        "en": "Section",
        "hi": "धारा"
      },
      "publisher": "National Crime Records Bureau (Sankalan)",
      "corpus": {
        "kind": "law",
        "file": "law/bns.json"
      },
      "tocSource": "chapters",
      "unitCount": 358,
      "estimatedMinutes": 335,
      "examTags": [
        "criminal-law",
        "investigation",
        "departmental-exam"
      ],
      "officialUrl": "https://www.ncrb.gov.in/uploads/SankalanPortal/ChaptersBNS.html",
      "source": {
        "name": "NCRB Sankalan — BNS / IPC correspondence table",
        "url": "https://www.ncrb.gov.in/uploads/SankalanPortal/SectionTableBNS.html"
      },
      "file": "works/bns.json",
      "verify": true
    },
    {
      "id": "bnss",
      "title": {
        "en": "Bharatiya Nagarik Suraksha Sanhita, 2023",
        "hi": "भारतीय नागरिक सुरक्षा संहिता, 2023"
      },
      "shortTitle": {
        "en": "BNSS",
        "hi": "BNSS"
      },
      "year": 2023,
      "category": "criminal-law",
      "description": {
        "en": "The Bharatiya Nagarik Suraksha Sanhita — criminal procedure from first information to appeal, replacing the Code of Criminal Procedure, 1973.",
        "hi": "भारतीय नागरिक सुरक्षा संहिता — प्रथम सूचना से अपील तक की दंड प्रक्रिया, जिसने दंड प्रक्रिया संहिता, 1973 का स्थान लिया।"
      },
      "unitLabel": {
        "en": "Section",
        "hi": "धारा"
      },
      "publisher": "National Crime Records Bureau (Sankalan)",
      "corpus": {
        "kind": "law",
        "file": "law/bnss.json"
      },
      "tocSource": "chapters",
      "unitCount": 531,
      "estimatedMinutes": 507,
      "examTags": [
        "criminal-procedure",
        "investigation",
        "departmental-exam"
      ],
      "officialUrl": "https://www.ncrb.gov.in/uploads/SankalanPortal/ChaptersBNSS.html",
      "source": {
        "name": "NCRB Sankalan — BNSS / CrPC correspondence table",
        "url": "https://www.ncrb.gov.in/uploads/SankalanPortal/SectionTableBNSS.html"
      },
      "file": "works/bnss.json",
      "verify": true
    },
    {
      "id": "bsa",
      "title": {
        "en": "Bharatiya Sakshya Adhiniyam, 2023",
        "hi": "भारतीय साक्ष्य अधिनियम, 2023"
      },
      "shortTitle": {
        "en": "BSA",
        "hi": "BSA"
      },
      "year": 2023,
      "category": "criminal-law",
      "description": {
        "en": "The Bharatiya Sakshya Adhiniyam — relevancy, admissibility, electronic records, burden of proof and witnesses, replacing the Indian Evidence Act, 1872.",
        "hi": "भारतीय साक्ष्य अधिनियम — सुसंगति, ग्राह्यता, इलेक्ट्रॉनिक अभिलेख, सबूत का भार तथा साक्षी, जिसने भारतीय साक्ष्य अधिनियम, 1872 का स्थान लिया।"
      },
      "unitLabel": {
        "en": "Section",
        "hi": "धारा"
      },
      "publisher": "National Crime Records Bureau (Sankalan)",
      "corpus": {
        "kind": "law",
        "file": "law/bsa.json"
      },
      "tocSource": "chapters",
      "unitCount": 170,
      "estimatedMinutes": 135,
      "examTags": [
        "evidence",
        "investigation"
      ],
      "officialUrl": "https://www.ncrb.gov.in/uploads/SankalanPortal/ChaptersBSA.html",
      "source": {
        "name": "NCRB Sankalan — BSA / IEA correspondence table",
        "url": "https://www.ncrb.gov.in/uploads/SankalanPortal/SectionTableBSA.html"
      },
      "file": "works/bsa.json",
      "verify": true
    },
    {
      "id": "ccs-cca",
      "title": {
        "en": "Central Civil Services (Classification, Control and Appeal) Rules, 1965",
        "hi": "केंद्रीय सिविल सेवा (वर्गीकरण, नियंत्रण और अपील) नियम, 1965"
      },
      "shortTitle": {
        "en": "CCS (CCA) Rules",
        "hi": "सीसीएस (सीसीए) नियम"
      },
      "year": 1965,
      "category": "service-rules",
      "description": {
        "en": "Classification of services, the penalties that may be imposed, who may impose them, and the inquiry and appeal procedure every disciplinary proceeding must follow.",
        "hi": "सेवाओं का वर्गीकरण, अधिरोपित की जा सकने वाली शास्तियाँ, उन्हें अधिरोपित करने वाला प्राधिकारी, तथा प्रत्येक अनुशासनिक कार्यवाही में अपनाई जाने वाली जाँच और अपील प्रक्रिया।"
      },
      "unitLabel": {
        "en": "Rule",
        "hi": "नियम"
      },
      "publisher": "Department of Personnel and Training",
      "corpus": {
        "kind": "rules",
        "file": "rules/text/ccs-cca.json"
      },
      "tocSource": "flat",
      "unitCount": 34,
      "estimatedMinutes": 193,
      "examTags": [
        "discipline",
        "vigilance",
        "departmental-exam",
        "ldce"
      ],
      "officialUrl": "https://dopt.gov.in/sites/default/files/CCS-CCA-Rules-FINAL.pdf",
      "source": {
        "name": "Department of Personnel and Training — CCS (CCA) Rules, 1965 — consolidated",
        "url": "https://dopt.gov.in/sites/default/files/CCS-CCA-Rules-FINAL.pdf"
      },
      "file": "works/ccs-cca.json",
      "verify": true
    },
    {
      "id": "ccs-conduct",
      "title": {
        "en": "Central Civil Services (Conduct) Rules, 1964",
        "hi": "केंद्रीय सिविल सेवा (आचरण) नियम, 1964"
      },
      "shortTitle": {
        "en": "CCS (Conduct) Rules",
        "hi": "सीसीएस (आचरण) नियम"
      },
      "year": 1964,
      "category": "service-rules",
      "description": {
        "en": "What a Government servant may and may not do — integrity, gifts, private trade, property returns, political activity and the conduct rules a disciplinary case is built on.",
        "hi": "सरकारी सेवक क्या कर सकता है और क्या नहीं — सत्यनिष्ठा, उपहार, निजी व्यापार, संपत्ति विवरणी, राजनीतिक गतिविधि तथा वे आचरण नियम जिन पर अनुशासनिक कार्रवाई आधारित होती है।"
      },
      "unitLabel": {
        "en": "Rule",
        "hi": "नियम"
      },
      "publisher": "Department of Personnel and Training",
      "corpus": {
        "kind": "rules",
        "file": "rules/text/ccs-conduct.json"
      },
      "tocSource": "flat",
      "unitCount": 32,
      "estimatedMinutes": 70,
      "examTags": [
        "conduct",
        "vigilance",
        "probation",
        "departmental-exam"
      ],
      "officialUrl": "https://dopt.gov.in/sites/default/files/CCS_Conduct_Rules_1964_Updated_27Feb15_0.pdf",
      "source": {
        "name": "Department of Personnel and Training — CCS (Conduct) Rules, 1964 — updated as on 27 February 2015",
        "url": "https://dopt.gov.in/sites/default/files/CCS_Conduct_Rules_1964_Updated_27Feb15_0.pdf"
      },
      "file": "works/ccs-conduct.json",
      "verify": true
    },
    {
      "id": "ccs-leave",
      "title": {
        "en": "Central Civil Services (Leave) Rules, 1972",
        "hi": "केंद्रीय सिविल सेवा (छुट्टी) नियम, 1972"
      },
      "shortTitle": {
        "en": "CCS (Leave) Rules",
        "hi": "सीसीएस (छुट्टी) नियम"
      },
      "year": 1972,
      "category": "service-rules",
      "description": {
        "en": "Every kind of leave a central Government servant can earn or take — earned leave, half pay, commuted, maternity, paternity, child care, study and extraordinary leave.",
        "hi": "केंद्रीय सरकारी सेवक द्वारा अर्जित या ली जा सकने वाली प्रत्येक प्रकार की छुट्टी — अर्जित अवकाश, अर्ध वेतन, परिवर्तित, प्रसूति, पितृत्व, शिशु देखभाल, अध्ययन तथा असाधारण छुट्टी।"
      },
      "unitLabel": {
        "en": "Rule",
        "hi": "नियम"
      },
      "publisher": "Department of Personnel and Training",
      "corpus": {
        "kind": "rules",
        "file": "rules/text/ccs-leave.json"
      },
      "tocSource": "flat",
      "unitCount": 75,
      "estimatedMinutes": 226,
      "examTags": [
        "leave",
        "establishment",
        "departmental-exam"
      ],
      "officialUrl": "https://documents.doptcirculars.nic.in/D2/D02est/updatedccsleaverulesN9ExV.pdf",
      "source": {
        "name": "Department of Personnel and Training — CCS (Leave) Rules, 1972 — updated as on 24 September 2024",
        "url": "https://documents.doptcirculars.nic.in/D2/D02est/updatedccsleaverulesN9ExV.pdf"
      },
      "file": "works/ccs-leave.json",
      "verify": true
    },
    {
      "id": "ccs-pension",
      "title": {
        "en": "Central Civil Services (Pension) Rules, 2021",
        "hi": "केंद्रीय सिविल सेवा (पेंशन) नियम, 2021"
      },
      "shortTitle": {
        "en": "CCS (Pension) Rules",
        "hi": "सीसीएस (पेंशन) नियम"
      },
      "year": 2021,
      "category": "service-rules",
      "description": {
        "en": "Qualifying service, superannuation, retirement and death gratuity, family pension, commutation and the papers a retiring officer's office has to put together.",
        "hi": "अर्हक सेवा, अधिवर्षिता, सेवानिवृत्ति और मृत्यु उपदान, पारिवारिक पेंशन, संराशीकरण तथा सेवानिवृत्त हो रहे अधिकारी के कार्यालय द्वारा तैयार किए जाने वाले दस्तावेज़।"
      },
      "unitLabel": {
        "en": "Rule",
        "hi": "नियम"
      },